[
  {
    "source_id": "cn-vendor-huorong-bundled-promotion-2023",
    "source_class": "security_vendor_public_article",
    "source_name": "火绒安全公开技术文章",
    "source_url": "https://www.huorong.cn/document/tech/vir_report/888.html",
    "source_title": "“云即玩”模拟器捆绑流氓软件，用户需提高警惕",
    "source_date": "2023-12-04",
    "source_access_status": "accessible",
    "claimed_entities": ["文章所述下载器与捆绑组件（候选，待人工拆分）"],
    "claimed_behaviors": ["捆绑推广", "静默安装", "推广快捷方式", "弹出推广网页", "计划任务持久化"],
    "platform_scope": "windows_installer_or_bundle",
    "source_reliability": "medium",
    "machine_readable": false,
    "license_note": "仅保存公开文章元数据和行为摘要，不复制检测材料。",
    "review_notes": "必须核对下载链路、文件身份、签名、版本与独立第二来源。",
    "allowed_use": "review_hint",
    "forbidden_use": ["delete_authorization", "uninstall_authorization", "disable_authorization", "registry_edit_authorization"],
    "version_or_time_scope": "文章发布时所述 2023 年下载链路和样本",
    "evidence_freshness": "time_scoped",
    "cross_source_count": 1,
    "requires_second_source": true,
    "candidate_id": "cn-candidate-huorong-2023-bundle-chain",
    "candidate_entity": "下载站捆绑链路（来源级候选，不是本机实体）",
    "candidate_status": "needs_human_review",
    "mapping_type": "source_level_only",
    "evidence_summary": "公开文章描述了特定下载链路中的捆绑、推广和持久化行为；尚不足以认定任何当前本机软件。",
    "execution_authorized": false
  },
  {
    "source_id": "cn-media-xinhua-pc-popup-guidance-2021",
    "source_class": "reputable_media_report",
    "source_name": "新华网",
    "source_url": "https://www.news.cn/politics/2021-10/29/c_1128011080.htm",
    "source_title": "工信部召开规范电脑PC端应用软件弹窗信息骚扰用户问题行政指导会",
    "source_date": "2021-10-29",
    "source_access_status": "accessible",
    "claimed_entities": ["报道中的参会企业集合（不得映射为问题软件清单）"],
    "claimed_behaviors": ["未经同意开机自启动弹窗", "弹窗难以关闭", "强制捆绑安装"],
    "platform_scope": "windows_desktop_software",
    "source_reliability": "medium",
    "machine_readable": false,
    "license_note": "仅保存新闻元数据和一般行为摘要。",
    "review_notes": "参会不等于违规结论，不能映射厂商全部产品。",
    "allowed_use": "explanation_only",
    "forbidden_use": ["delete_authorization", "uninstall_authorization", "disable_authorization", "registry_edit_authorization"],
    "version_or_time_scope": "2021 年 PC 端弹窗治理背景",
    "evidence_freshness": "time_scoped",
    "cross_source_count": 1,
    "requires_second_source": true,
    "candidate_id": "cn-candidate-xinhua-2021-pc-popup-behavior",
    "candidate_entity": "PC 端弹窗与强制捆绑行为（非厂商级结论）",
    "candidate_status": "needs_human_review",
    "mapping_type": "source_level_only",
    "evidence_summary": "报道可帮助定义需要复核的 PC 行为，但单篇报道不能确认具体软件或当前版本。",
    "execution_authorized": false
  },
  {
    "source_id": "cn-community-12321-reporting-portal",
    "source_class": "community_multi_report",
    "source_name": "12321 网络不良与垃圾信息举报受理中心",
    "source_url": "https://www.12321.cn/",
    "source_title": "12321 网络不良与垃圾信息举报受理入口",
    "source_date": "unknown",
    "source_access_status": "accessible",
    "claimed_entities": [],
    "claimed_behaviors": ["用户举报线索", "骚扰信息线索", "应用侵权线索"],
    "platform_scope": "cross_platform_behavior",
    "source_reliability": "low",
    "machine_readable": false,
    "license_note": "只记录公开入口；不联网提交、不抓取、不保存举报人数据。",
    "review_notes": "没有具体可核验记录前只能保留来源级候选。",
    "allowed_use": "candidate_only",
    "forbidden_use": ["delete_authorization", "uninstall_authorization", "disable_authorization", "registry_edit_authorization"],
    "version_or_time_scope": "持续运行入口；具体记录日期未知",
    "evidence_freshness": "unknown",
    "cross_source_count": 0,
    "requires_second_source": true,
    "candidate_id": "cn-candidate-12321-user-report-channel",
    "candidate_entity": "未指定实体（用户举报入口）",
    "candidate_status": "candidate_only",
    "mapping_type": "source_level_only",
    "evidence_summary": "举报入口可提示后续人工收集方向，但入口本身不证明任何实体或行为。",
    "execution_authorized": false
  },
  {
    "source_id": "cn-user-list-anti-ad-github",
    "source_class": "user_blocklist_or_forum_list",
    "source_name": "Anti-AD 开源社区项目",
    "source_url": "https://github.com/privacy-protection-tools/anti-AD",
    "source_title": "Anti-AD 中文广告过滤与隐私保护列表",
    "source_date": "unknown",
    "source_access_status": "accessible",
    "claimed_entities": [],
    "claimed_behaviors": ["广告域名过滤", "跟踪域名过滤"],
    "platform_scope": "online_domain_blocklist",
    "source_reliability": "low",
    "machine_readable": true,
    "license_note": "只记录仓库元数据，不复制、下载或导入域名列表。",
    "review_notes": "域名条目和软件实体没有可靠的一对一关系。",
    "allowed_use": "candidate_only",
    "forbidden_use": ["delete_authorization", "uninstall_authorization", "disable_authorization", "registry_edit_authorization"],
    "version_or_time_scope": "持续更新；未固定版本",
    "evidence_freshness": "unknown",
    "cross_source_count": 0,
    "requires_second_source": true,
    "candidate_id": "cn-candidate-anti-ad-project-metadata",
    "candidate_entity": "域名级条目集合（不得映射本机软件）",
    "candidate_status": "candidate_only",
    "mapping_type": "source_level_only",
    "evidence_summary": "社区维护的域名过滤信息与 Windows 软件身份不同，只能作为进一步调查的弱线索。",
    "execution_authorized": false
  }
]
